<?xml version="1.0" encoding="UTF-8" ?>
<apartments
        xmlns="http://www.task.org/apartment"
        xmlns:xsi="http://www.w3.org/2001/XMLSchema-instance"
        xsi:schemaLocation="http://www.task.org/apartment apartment.xsd" >
    <apartment id="1">
        <floor>1</floor>
        <room>101</room>
        <balcony>true</balcony>
    </apartment>
    <apartment id="2">
        <floor>1</floor>
        <room>102</room>
        <balcony>false</balcony>
    </apartment>
</apartments>